ApplicationID,JobID,ApplicantID,TimeOfApplication,CV,StatementOfPurpose,ExpectToGain,Questions,ApplicationStatus
127,905,663,2021-04-09 10:59:00,InHac.mp3,"Morbi porttitor lorem id ligula. Suspendisse ornare consequat lectus. In est risus, auctor sed, tristique in, tempus sit amet, sem.","Curabitur in libero ut massa volutpat convallis. Morbi odio odio, elementum eu, interdum eu, tincidunt in, leo. Maecenas pulvinar lobortis est.",Phasellus sit amet erat. Nulla tempus. Vivamus in felis eu sapien cursus vestibulum.,Failed
136,28,930,2021-04-11 04:46:00,Id.png,In hac habitasse platea dictumst. Etiam faucibus cursus urna. Ut tellus.,In congue. Etiam justo. Etiam pretium iaculis justo.,"Aenean fermentum. Donec ut mauris eget massa tempor convallis. Nulla neque libero, convallis eget, eleifend luctus, ultricies eu, nibh.",Failed
137,917,602,2021-07-22 16:25:00,AdipiscingElit.mp3,"Mauris enim leo, rhoncus sed, vestibulum sit amet, cursus id, turpis. Integer aliquet, massa id lobortis convallis, tortor risus dapibus augue, vel accumsan tellus nisi eu orci. Mauris lacinia sapien quis libero.",Phasellus sit amet erat. Nulla tempus. Vivamus in felis eu sapien cursus vestibulum.,"Vestibulum ac est lacinia nisi venenatis tristique. Fusce congue, diam id ornare imperdiet, sapien urna pretium nisl, ut volutpat sapien arcu sed augue. Aliquam erat volutpat.",Failed
139,868,489,2021-01-31 20:39:00,Donec.xls,Nullam porttitor lacus at turpis. Donec posuere metus vitae ipsum. Aliquam non mauris.,"Mauris enim leo, rhoncus sed, vestibulum sit amet, cursus id, turpis. Integer aliquet, massa id lobortis convallis, tortor risus dapibus augue, vel accumsan tellus nisi eu orci. Mauris lacinia sapien quis libero.","Maecenas tristique, est et tempus semper, est quam pharetra magna, ac consequat metus sapien ut nunc. Vestibulum ante ipsum primis in faucibus orci luctus et ultrices posuere cubilia Curae; Mauris viverra diam vitae quam. Suspendisse potenti.",Failed
141,704,734,2021-11-26 05:32:00,Sociis.avi,"Aenean fermentum. Donec ut mauris eget massa tempor convallis. Nulla neque libero, convallis eget, eleifend luctus, ultricies eu, nibh.","Sed sagittis. Nam congue, risus semper porta volutpat, quam pede lobortis ligula, sit amet eleifend pede libero quis orci. Nullam molestie nibh in lectus.",Fusce consequat. Nulla nisl. Nunc nisl.,Failed
145,270,542,2021-08-12 06:56:00,Tristique.mp3,"Curabitur at ipsum ac tellus semper interdum. Mauris ullamcorper purus sit amet nulla. Quisque arcu libero, rutrum ac, lobortis vel, dapibus at, diam.",Etiam vel augue. Vestibulum rutrum rutrum neque. Aenean auctor gravida sem.,,Failed
153,603,879,2021-02-15 12:16:00,Ultrices.tiff,"Curabitur gravida nisi at nibh. In hac habitasse platea dictumst. Aliquam augue quam, sollicitudin vitae, consectetuer eget, rutrum at, lorem.","In sagittis dui vel nisl. Duis ac nibh. Fusce lacus purus, aliquet at, feugiat non, pretium quis, lectus.",,Failed
158,839,226,2021-12-03 18:53:00,RhoncusSedVestibulum.mp3,Nullam sit amet turpis elementum ligula vehicula consequat. Morbi a ipsum. Integer a nibh.,"Duis bibendum, felis sed interdum venenatis, turpis enim blandit mi, in porttitor pede justo eu massa. Donec dapibus. Duis at velit eu est congue elementum.",,Failed
162,735,602,2021-09-26 06:33:00,TortorQuis.xls,Nulla ut erat id mauris vulputate elementum. Nullam varius. Nulla facilisi.,"In hac habitasse platea dictumst. Morbi vestibulum, velit id pretium iaculis, diam erat fermentum justo, nec condimentum neque sapien placerat ante. Nulla justo.","Donec diam neque, vestibulum eget, vulputate ut, ultrices vel, augue. Vestibulum ante ipsum primis in faucibus orci luctus et ultrices posuere cubilia Curae; Donec pharetra, magna vestibulum aliquet ultrices, erat tortor sollicitudin mi, sit amet lobortis sapien sapien non mi. Integer ac neque.",Failed
171,909,278,2021-07-08 22:25:00,Vivamus.mov,Aenean lectus. Pellentesque eget nunc. Donec quis orci eget orci vehicula condimentum.,"Maecenas tristique, est et tempus semper, est quam pharetra magna, ac consequat metus sapien ut nunc. Vestibulum ante ipsum primis in faucibus orci luctus et ultrices posuere cubilia Curae; Mauris viverra diam vitae quam. Suspendisse potenti.",Duis aliquam convallis nunc. Proin at turpis a pede posuere nonummy. Integer non velit.,Failed
173,771,273,2021-06-10 20:57:00,DapibusNullaSuscipit.doc,Nulla ut erat id mauris vulputate elementum. Nullam varius. Nulla facilisi.,Pellentesque at nulla. Suspendisse potenti. Cras in purus eu magna vulputate luctus.,Nulla ut erat id mauris vulputate elementum. Nullam varius. Nulla facilisi.,Failed
174,197,903,2021-06-29 05:21:00,RhoncusAliquetPulvinar.txt,"Curabitur gravida nisi at nibh. In hac habitasse platea dictumst. Aliquam augue quam, sollicitudin vitae, consectetuer eget, rutrum at, lorem.","Cum sociis natoque penatibus et magnis dis parturient montes, nascetur ridiculus mus. Vivamus vestibulum sagittis sapien. Cum sociis natoque penatibus et magnis dis parturient montes, nascetur ridiculus mus.",Maecenas ut massa quis augue luctus tincidunt. Nulla mollis molestie lorem. Quisque ut erat.,Failed
189,242,714,2021-08-14 04:26:00,InQuis.mp3,Pellentesque at nulla. Suspendisse potenti. Cras in purus eu magna vulputate luctus.,Cras non velit nec nisi vulputate nonummy. Maecenas tincidunt lacus at velit. Vivamus vel nulla eget eros elementum pellentesque.,Praesent id massa id nisl venenatis lacinia. Aenean sit amet justo. Morbi ut odio.,Failed
192,96,718,2021-06-08 08:44:00,QuisTurpis.ppt,Duis aliquam convallis nunc. Proin at turpis a pede posuere nonummy. Integer non velit.,"Proin eu mi. Nulla ac enim. In tempor, turpis nec euismod scelerisque, quam turpis adipiscing lorem, vitae mattis nibh ligula nec sem.",Maecenas ut massa quis augue luctus tincidunt. Nulla mollis molestie lorem. Quisque ut erat.,Failed
203,336,286,2021-04-03 23:51:00,InHacHabitasse.tiff,"Donec diam neque, vestibulum eget, vulputate ut, ultrices vel, augue. Vestibulum ante ipsum primis in faucibus orci luctus et ultrices posuere cubilia Curae; Donec pharetra, magna vestibulum aliquet ultrices, erat tortor sollicitudin mi, sit amet lobortis sapien sapien non mi. Integer ac neque.","Vestibulum quam sapien, varius ut, blandit non, interdum in, ante. Vestibulum ante ipsum primis in faucibus orci luctus et ultrices posuere cubilia Curae; Duis faucibus accumsan odio. Curabitur convallis.","Curabitur in libero ut massa volutpat convallis. Morbi odio odio, elementum eu, interdum eu, tincidunt in, leo. Maecenas pulvinar lobortis est.",Failed
215,27,714,2021-04-05 04:23:00,FelisEu.mov,"In hac habitasse platea dictumst. Morbi vestibulum, velit id pretium iaculis, diam erat fermentum justo, nec condimentum neque sapien placerat ante. Nulla justo.",Praesent id massa id nisl venenatis lacinia. Aenean sit amet justo. Morbi ut odio.,,Failed
221,20,974,2021-06-22 13:14:00,NonPretium.tiff,"In hac habitasse platea dictumst. Morbi vestibulum, velit id pretium iaculis, diam erat fermentum justo, nec condimentum neque sapien placerat ante. Nulla justo.",Duis bibendum. Morbi non quam nec dui luctus rutrum. Nulla tellus.,Aenean lectus. Pellentesque eget nunc. Donec quis orci eget orci vehicula condimentum.,Failed
234,754,987,2021-04-27 22:52:00,NullamSit.xls,Phasellus in felis. Donec semper sapien a libero. Nam dui.,"Mauris enim leo, rhoncus sed, vestibulum sit amet, cursus id, turpis. Integer aliquet, massa id lobortis convallis, tortor risus dapibus augue, vel accumsan tellus nisi eu orci. Mauris lacinia sapien quis libero.",,Failed
235,314,566,2021-03-18 02:11:00,NonVelitNec.xls,In congue. Etiam justo. Etiam pretium iaculis justo.,"Maecenas tristique, est et tempus semper, est quam pharetra magna, ac consequat metus sapien ut nunc. Vestibulum ante ipsum primis in faucibus orci luctus et ultrices posuere cubilia Curae; Mauris viverra diam vitae quam. Suspendisse potenti.","Morbi non lectus. Aliquam sit amet diam in magna bibendum imperdiet. Nullam orci pede, venenatis non, sodales sed, tincidunt eu, felis.",Failed
236,363,941,2021-10-02 08:34:00,FaucibusOrciLuctus.tiff,"Cras mi pede, malesuada in, imperdiet et, commodo vulputate, justo. In blandit ultrices enim. Lorem ipsum dolor sit amet, consectetuer adipiscing elit.",Phasellus in felis. Donec semper sapien a libero. Nam dui.,"Vestibulum quam sapien, varius ut, blandit non, interdum in, ante. Vestibulum ante ipsum primis in faucibus orci luctus et ultrices posuere cubilia Curae; Duis faucibus accumsan odio. Curabitur convallis.",Failed
239,742,259,2021-06-26 21:37:00,LaciniaNisiVenenatis.mov,"Sed sagittis. Nam congue, risus semper porta volutpat, quam pede lobortis ligula, sit amet eleifend pede libero quis orci. Nullam molestie nibh in lectus.",Duis aliquam convallis nunc. Proin at turpis a pede posuere nonummy. Integer non velit.,"Nam ultrices, libero non mattis pulvinar, nulla pede ullamcorper augue, a suscipit nulla elit ac nulla. Sed vel enim sit amet nunc viverra dapibus. Nulla suscipit ligula in lacus.",Failed
240,788,535,2021-08-19 06:20:00,VelitDonec.xls,Duis bibendum. Morbi non quam nec dui luctus rutrum. Nulla tellus.,Nullam porttitor lacus at turpis. Donec posuere metus vitae ipsum. Aliquam non mauris.,,Failed
249,847,398,2021-07-05 11:44:00,EstEtTempus.mp3,"Fusce posuere felis sed lacus. Morbi sem mauris, laoreet ut, rhoncus aliquet, pulvinar sed, nisl. Nunc rhoncus dui vel sem.","In sagittis dui vel nisl. Duis ac nibh. Fusce lacus purus, aliquet at, feugiat non, pretium quis, lectus.",,Failed
251,998,37,2021-08-25 08:22:00,QuamSapienVarius.ppt,"In sagittis dui vel nisl. Duis ac nibh. Fusce lacus purus, aliquet at, feugiat non, pretium quis, lectus.",Nulla ut erat id mauris vulputate elementum. Nullam varius. Nulla facilisi.,,Failed
254,770,34,2021-03-30 10:31:00,Donec.mpeg,"Morbi porttitor lorem id ligula. Suspendisse ornare consequat lectus. In est risus, auctor sed, tristique in, tempus sit amet, sem.","Proin interdum mauris non ligula pellentesque ultrices. Phasellus id sapien in sapien iaculis congue. Vivamus metus arcu, adipiscing molestie, hendrerit at, vulputate vitae, nisl.","Vestibulum ac est lacinia nisi venenatis tristique. Fusce congue, diam id ornare imperdiet, sapien urna pretium nisl, ut volutpat sapien arcu sed augue. Aliquam erat volutpat.",Failed
260,609,630,2021-06-09 12:12:00,Phasellus.mov,Maecenas ut massa quis augue luctus tincidunt. Nulla mollis molestie lorem. Quisque ut erat.,Duis aliquam convallis nunc. Proin at turpis a pede posuere nonummy. Integer non velit.,"Proin leo odio, porttitor id, consequat in, consequat ut, nulla. Sed accumsan felis. Ut at dolor quis odio consequat varius.",Failed
268,169,723,2021-12-07 09:05:00,Metus.jpeg,Sed ante. Vivamus tortor. Duis mattis egestas metus.,Phasellus in felis. Donec semper sapien a libero. Nam dui.,Duis consequat dui nec nisi volutpat eleifend. Donec ut dolor. Morbi vel lectus in quam fringilla rhoncus.,Failed
274,372,91,2021-03-29 21:18:00,Metus.avi,Nullam porttitor lacus at turpis. Donec posuere metus vitae ipsum. Aliquam non mauris.,"Donec diam neque, vestibulum eget, vulputate ut, ultrices vel, augue. Vestibulum ante ipsum primis in faucibus orci luctus et ultrices posuere cubilia Curae; Donec pharetra, magna vestibulum aliquet ultrices, erat tortor sollicitudin mi, sit amet lobortis sapien sapien non mi. Integer ac neque.",,Failed
277,251,641,2021-03-18 03:17:00,MorbiUtOdio.tiff,Pellentesque at nulla. Suspendisse potenti. Cras in purus eu magna vulputate luctus.,"Quisque id justo sit amet sapien dignissim vestibulum. Vestibulum ante ipsum primis in faucibus orci luctus et ultrices posuere cubilia Curae; Nulla dapibus dolor vel est. Donec odio justo, sollicitudin ut, suscipit a, feugiat et, eros.","Praesent blandit. Nam nulla. Integer pede justo, lacinia eget, tincidunt eget, tempus vel, pede.",Failed
281,722,883,2021-02-05 05:02:00,Pretium.tiff,"In sagittis dui vel nisl. Duis ac nibh. Fusce lacus purus, aliquet at, feugiat non, pretium quis, lectus.",Duis consequat dui nec nisi volutpat eleifend. Donec ut dolor. Morbi vel lectus in quam fringilla rhoncus.,"Cras mi pede, malesuada in, imperdiet et, commodo vulputate, justo. In blandit ultrices enim. Lorem ipsum dolor sit amet, consectetuer adipiscing elit.",Failed
283,634,286,2021-07-02 21:00:00,Accumsan.xls,Fusce consequat. Nulla nisl. Nunc nisl.,In hac habitasse platea dictumst. Etiam faucibus cursus urna. Ut tellus.,Aenean lectus. Pellentesque eget nunc. Donec quis orci eget orci vehicula condimentum.,Failed
285,284,442,2021-12-29 19:23:00,TurpisIntegerAliquet.xls,Duis bibendum. Morbi non quam nec dui luctus rutrum. Nulla tellus.,Phasellus in felis. Donec semper sapien a libero. Nam dui.,Duis consequat dui nec nisi volutpat eleifend. Donec ut dolor. Morbi vel lectus in quam fringilla rhoncus.,Failed
288,771,386,2021-01-18 07:51:00,IntegerAcNeque.jpeg,In hac habitasse platea dictumst. Etiam faucibus cursus urna. Ut tellus.,"Curabitur at ipsum ac tellus semper interdum. Mauris ullamcorper purus sit amet nulla. Quisque arcu libero, rutrum ac, lobortis vel, dapibus at, diam.",,Failed
289,152,298,2021-08-05 21:23:00,QuisTurpisSed.ppt,Nullam sit amet turpis elementum ligula vehicula consequat. Morbi a ipsum. Integer a nibh.,Cras non velit nec nisi vulputate nonummy. Maecenas tincidunt lacus at velit. Vivamus vel nulla eget eros elementum pellentesque.,"Proin leo odio, porttitor id, consequat in, consequat ut, nulla. Sed accumsan felis. Ut at dolor quis odio consequat varius.",Failed
295,311,770,2021-05-08 18:53:00,EtiamVelAugue.doc,"In sagittis dui vel nisl. Duis ac nibh. Fusce lacus purus, aliquet at, feugiat non, pretium quis, lectus.",Integer tincidunt ante vel ipsum. Praesent blandit lacinia erat. Vestibulum sed magna at nunc commodo placerat.,In quis justo. Maecenas rhoncus aliquam lacus. Morbi quis tortor id nulla ultrices aliquet.,Failed
297,323,910,2021-03-21 00:06:00,Massa.txt,"Maecenas leo odio, condimentum id, luctus nec, molestie sed, justo. Pellentesque viverra pede ac diam. Cras pellentesque volutpat dui.",Integer ac leo. Pellentesque ultrices mattis odio. Donec vitae nisi.,"Donec diam neque, vestibulum eget, vulputate ut, ultrices vel, augue. Vestibulum ante ipsum primis in faucibus orci luctus et ultrices posuere cubilia Curae; Donec pharetra, magna vestibulum aliquet ultrices, erat tortor sollicitudin mi, sit amet lobortis sapien sapien non mi. Integer ac neque.",Failed
300,869,801,2021-08-07 08:12:00,NequeVestibulum.pdf,"Proin eu mi. Nulla ac enim. In tempor, turpis nec euismod scelerisque, quam turpis adipiscing lorem, vitae mattis nibh ligula nec sem.","Vestibulum quam sapien, varius ut, blandit non, interdum in, ante. Vestibulum ante ipsum primis in faucibus orci luctus et ultrices posuere cubilia Curae; Duis faucibus accumsan odio. Curabitur convallis.","Curabitur gravida nisi at nibh. In hac habitasse platea dictumst. Aliquam augue quam, sollicitudin vitae, consectetuer eget, rutrum at, lorem.",Failed
304,459,800,2021-01-30 16:14:00,Tristique.avi,"Maecenas tristique, est et tempus semper, est quam pharetra magna, ac consequat metus sapien ut nunc. Vestibulum ante ipsum primis in faucibus orci luctus et ultrices posuere cubilia Curae; Mauris viverra diam vitae quam. Suspendisse potenti.",Nulla ut erat id mauris vulputate elementum. Nullam varius. Nulla facilisi.,Fusce consequat. Nulla nisl. Nunc nisl.,Failed
309,432,225,2021-01-18 01:43:00,Phasellus.xls,"Curabitur at ipsum ac tellus semper interdum. Mauris ullamcorper purus sit amet nulla. Quisque arcu libero, rutrum ac, lobortis vel, dapibus at, diam.","Morbi porttitor lorem id ligula. Suspendisse ornare consequat lectus. In est risus, auctor sed, tristique in, tempus sit amet, sem.","In hac habitasse platea dictumst. Morbi vestibulum, velit id pretium iaculis, diam erat fermentum justo, nec condimentum neque sapien placerat ante. Nulla justo.",Failed
319,541,517,2021-10-31 14:36:00,In.avi,"Proin eu mi. Nulla ac enim. In tempor, turpis nec euismod scelerisque, quam turpis adipiscing lorem, vitae mattis nibh ligula nec sem.","Nam ultrices, libero non mattis pulvinar, nulla pede ullamcorper augue, a suscipit nulla elit ac nulla. Sed vel enim sit amet nunc viverra dapibus. Nulla suscipit ligula in lacus.",Duis consequat dui nec nisi volutpat eleifend. Donec ut dolor. Morbi vel lectus in quam fringilla rhoncus.,Failed
327,613,512,2021-04-30 04:45:00,EstCongue.pdf,"In sagittis dui vel nisl. Duis ac nibh. Fusce lacus purus, aliquet at, feugiat non, pretium quis, lectus.","Cum sociis natoque penatibus et magnis dis parturient montes, nascetur ridiculus mus. Vivamus vestibulum sagittis sapien. Cum sociis natoque penatibus et magnis dis parturient montes, nascetur ridiculus mus.",Integer ac leo. Pellentesque ultrices mattis odio. Donec vitae nisi.,Failed
333,185,532,2021-02-03 21:22:00,Sem.mp3,"Vestibulum quam sapien, varius ut, blandit non, interdum in, ante. Vestibulum ante ipsum primis in faucibus orci luctus et ultrices posuere cubilia Curae; Duis faucibus accumsan odio. Curabitur convallis.","Praesent blandit. Nam nulla. Integer pede justo, lacinia eget, tincidunt eget, tempus vel, pede.",,Failed
334,293,556,2021-06-21 18:40:00,Volutpat.jpeg,Pellentesque at nulla. Suspendisse potenti. Cras in purus eu magna vulputate luctus.,Phasellus sit amet erat. Nulla tempus. Vivamus in felis eu sapien cursus vestibulum.,Cras non velit nec nisi vulputate nonummy. Maecenas tincidunt lacus at velit. Vivamus vel nulla eget eros elementum pellentesque.,Failed
337,548,875,2021-05-20 21:36:00,DuisAliquam.avi,"Morbi non lectus. Aliquam sit amet diam in magna bibendum imperdiet. Nullam orci pede, venenatis non, sodales sed, tincidunt eu, felis.","Maecenas tristique, est et tempus semper, est quam pharetra magna, ac consequat metus sapien ut nunc. Vestibulum ante ipsum primis in faucibus orci luctus et ultrices posuere cubilia Curae; Mauris viverra diam vitae quam. Suspendisse potenti.","Quisque porta volutpat erat. Quisque erat eros, viverra eget, congue eget, semper rutrum, nulla. Nunc purus.",Failed
343,347,800,2021-04-29 13:06:00,Velit.txt,Maecenas ut massa quis augue luctus tincidunt. Nulla mollis molestie lorem. Quisque ut erat.,"Maecenas tristique, est et tempus semper, est quam pharetra magna, ac consequat metus sapien ut nunc. Vestibulum ante ipsum primis in faucibus orci luctus et ultrices posuere cubilia Curae; Mauris viverra diam vitae quam. Suspendisse potenti.","Curabitur in libero ut massa volutpat convallis. Morbi odio odio, elementum eu, interdum eu, tincidunt in, leo. Maecenas pulvinar lobortis est.",Failed
346,240,298,2021-07-27 12:10:00,Leo.doc,Suspendisse potenti. In eleifend quam a odio. In hac habitasse platea dictumst.,"Proin eu mi. Nulla ac enim. In tempor, turpis nec euismod scelerisque, quam turpis adipiscing lorem, vitae mattis nibh ligula nec sem.",,Failed
349,965,448,2021-10-31 17:26:00,Nibh.ppt,Sed ante. Vivamus tortor. Duis mattis egestas metus.,Maecenas ut massa quis augue luctus tincidunt. Nulla mollis molestie lorem. Quisque ut erat.,"Fusce posuere felis sed lacus. Morbi sem mauris, laoreet ut, rhoncus aliquet, pulvinar sed, nisl. Nunc rhoncus dui vel sem.",Failed
359,240,781,2021-05-10 01:48:00,TortorQuis.mp3,Duis consequat dui nec nisi volutpat eleifend. Donec ut dolor. Morbi vel lectus in quam fringilla rhoncus.,"Quisque id justo sit amet sapien dignissim vestibulum. Vestibulum ante ipsum primis in faucibus orci luctus et ultrices posuere cubilia Curae; Nulla dapibus dolor vel est. Donec odio justo, sollicitudin ut, suscipit a, feugiat et, eros.",Pellentesque at nulla. Suspendisse potenti. Cras in purus eu magna vulputate luctus.,Failed
362,9,220,2021-08-01 17:39:00,AtLoremInteger.mpeg,"Cum sociis natoque penatibus et magnis dis parturient montes, nascetur ridiculus mus. Vivamus vestibulum sagittis sapien. Cum sociis natoque penatibus et magnis dis parturient montes, nascetur ridiculus mus.",Duis bibendum. Morbi non quam nec dui luctus rutrum. Nulla tellus.,Nullam sit amet turpis elementum ligula vehicula consequat. Morbi a ipsum. Integer a nibh.,Failed
380,808,115,2021-07-18 11:31:00,Pede.txt,"Duis bibendum, felis sed interdum venenatis, turpis enim blandit mi, in porttitor pede justo eu massa. Donec dapibus. Duis at velit eu est congue elementum.",Integer tincidunt ante vel ipsum. Praesent blandit lacinia erat. Vestibulum sed magna at nunc commodo placerat.,"Aenean fermentum. Donec ut mauris eget massa tempor convallis. Nulla neque libero, convallis eget, eleifend luctus, ultricies eu, nibh.",Failed
386,397,916,2021-07-03 09:15:00,AmetConsectetuer.mov,"Curabitur in libero ut massa volutpat convallis. Morbi odio odio, elementum eu, interdum eu, tincidunt in, leo. Maecenas pulvinar lobortis est.","In hac habitasse platea dictumst. Morbi vestibulum, velit id pretium iaculis, diam erat fermentum justo, nec condimentum neque sapien placerat ante. Nulla justo.",Nullam sit amet turpis elementum ligula vehicula consequat. Morbi a ipsum. Integer a nibh.,Failed
406,364,255,2021-05-10 14:39:00,DuiVelNisl.avi,"Vestibulum ac est lacinia nisi venenatis tristique. Fusce congue, diam id ornare imperdiet, sapien urna pretium nisl, ut volutpat sapien arcu sed augue. Aliquam erat volutpat.","Proin eu mi. Nulla ac enim. In tempor, turpis nec euismod scelerisque, quam turpis adipiscing lorem, vitae mattis nibh ligula nec sem.",,Failed
419,118,568,2021-06-04 12:55:00,FelisEu.avi,"Cras mi pede, malesuada in, imperdiet et, commodo vulputate, justo. In blandit ultrices enim. Lorem ipsum dolor sit amet, consectetuer adipiscing elit.",Phasellus sit amet erat. Nulla tempus. Vivamus in felis eu sapien cursus vestibulum.,"Curabitur in libero ut massa volutpat convallis. Morbi odio odio, elementum eu, interdum eu, tincidunt in, leo. Maecenas pulvinar lobortis est.",Failed
431,568,823,2021-09-05 09:34:00,Quis.tiff,Integer ac leo. Pellentesque ultrices mattis odio. Donec vitae nisi.,"Vestibulum ac est lacinia nisi venenatis tristique. Fusce congue, diam id ornare imperdiet, sapien urna pretium nisl, ut volutpat sapien arcu sed augue. Aliquam erat volutpat.","Proin leo odio, porttitor id, consequat in, consequat ut, nulla. Sed accumsan felis. Ut at dolor quis odio consequat varius.",Failed
434,13,384,2021-04-25 05:55:00,DonecUtMauris.mov,"Curabitur in libero ut massa volutpat convallis. Morbi odio odio, elementum eu, interdum eu, tincidunt in, leo. Maecenas pulvinar lobortis est.",Duis consequat dui nec nisi volutpat eleifend. Donec ut dolor. Morbi vel lectus in quam fringilla rhoncus.,,Failed
442,386,164,2021-10-14 14:24:00,TortorEu.jpeg,"Donec diam neque, vestibulum eget, vulputate ut, ultrices vel, augue. Vestibulum ante ipsum primis in faucibus orci luctus et ultrices posuere cubilia Curae; Donec pharetra, magna vestibulum aliquet ultrices, erat tortor sollicitudin mi, sit amet lobortis sapien sapien non mi. Integer ac neque.","Curabitur gravida nisi at nibh. In hac habitasse platea dictumst. Aliquam augue quam, sollicitudin vitae, consectetuer eget, rutrum at, lorem.","Sed sagittis. Nam congue, risus semper porta volutpat, quam pede lobortis ligula, sit amet eleifend pede libero quis orci. Nullam molestie nibh in lectus.",Failed
452,743,27,2021-01-24 07:51:00,NequeSapienPlacerat.mp3,"Curabitur at ipsum ac tellus semper interdum. Mauris ullamcorper purus sit amet nulla. Quisque arcu libero, rutrum ac, lobortis vel, dapibus at, diam.",Duis aliquam convallis nunc. Proin at turpis a pede posuere nonummy. Integer non velit.,"Morbi non lectus. Aliquam sit amet diam in magna bibendum imperdiet. Nullam orci pede, venenatis non, sodales sed, tincidunt eu, felis.",Failed
453,621,727,2021-01-16 19:10:00,IdTurpis.gif,"Quisque id justo sit amet sapien dignissim vestibulum. Vestibulum ante ipsum primis in faucibus orci luctus et ultrices posuere cubilia Curae; Nulla dapibus dolor vel est. Donec odio justo, sollicitudin ut, suscipit a, feugiat et, eros.","Proin eu mi. Nulla ac enim. In tempor, turpis nec euismod scelerisque, quam turpis adipiscing lorem, vitae mattis nibh ligula nec sem.","Maecenas leo odio, condimentum id, luctus nec, molestie sed, justo. Pellentesque viverra pede ac diam. Cras pellentesque volutpat dui.",Failed
455,804,160,2021-05-13 16:31:00,EuOrci.mov,"Curabitur at ipsum ac tellus semper interdum. Mauris ullamcorper purus sit amet nulla. Quisque arcu libero, rutrum ac, lobortis vel, dapibus at, diam.","Lorem ipsum dolor sit amet, consectetuer adipiscing elit. Proin risus. Praesent lectus.",,Failed
465,208,620,2021-03-20 03:20:00,PraesentBlandit.avi,Etiam vel augue. Vestibulum rutrum rutrum neque. Aenean auctor gravida sem.,"Maecenas leo odio, condimentum id, luctus nec, molestie sed, justo. Pellentesque viverra pede ac diam. Cras pellentesque volutpat dui.","Proin interdum mauris non ligula pellentesque ultrices. Phasellus id sapien in sapien iaculis congue. Vivamus metus arcu, adipiscing molestie, hendrerit at, vulputate vitae, nisl.",Failed
466,999,131,2021-11-15 21:33:00,CurabiturGravidaNisi.xls,In quis justo. Maecenas rhoncus aliquam lacus. Morbi quis tortor id nulla ultrices aliquet.,"Vestibulum ac est lacinia nisi venenatis tristique. Fusce congue, diam id ornare imperdiet, sapien urna pretium nisl, ut volutpat sapien arcu sed augue. Aliquam erat volutpat.","Proin leo odio, porttitor id, consequat in, consequat ut, nulla. Sed accumsan felis. Ut at dolor quis odio consequat varius.",Failed
467,698,100,2021-02-24 19:37:00,Ut.tiff,"Aenean fermentum. Donec ut mauris eget massa tempor convallis. Nulla neque libero, convallis eget, eleifend luctus, ultricies eu, nibh.",Cras non velit nec nisi vulputate nonummy. Maecenas tincidunt lacus at velit. Vivamus vel nulla eget eros elementum pellentesque.,"Lorem ipsum dolor sit amet, consectetuer adipiscing elit. Proin risus. Praesent lectus.",Failed
