ApplicationID,JobID,ApplicantID,TimeOfApplication,CV,StatementOfPurpose,ExpectToGain,Questions,ApplicationStatus
4,290,591,2021-01-23 07:14:00,Ultrices.mp3,"Praesent blandit. Nam nulla. Integer pede justo, lacinia eget, tincidunt eget, tempus vel, pede.","Proin interdum mauris non ligula pellentesque ultrices. Phasellus id sapien in sapien iaculis congue. Vivamus metus arcu, adipiscing molestie, hendrerit at, vulputate vitae, nisl.",Maecenas ut massa quis augue luctus tincidunt. Nulla mollis molestie lorem. Quisque ut erat.,Applying
6,914,21,2021-01-19 14:06:00,LacusMorbi.doc,Fusce consequat. Nulla nisl. Nunc nisl.,Fusce consequat. Nulla nisl. Nunc nisl.,,Applying
7,748,860,2021-10-25 10:32:00,LiberoRutrumAc.avi,Sed ante. Vivamus tortor. Duis mattis egestas metus.,"Proin leo odio, porttitor id, consequat in, consequat ut, nulla. Sed accumsan felis. Ut at dolor quis odio consequat varius.","Cum sociis natoque penatibus et magnis dis parturient montes, nascetur ridiculus mus. Vivamus vestibulum sagittis sapien. Cum sociis natoque penatibus et magnis dis parturient montes, nascetur ridiculus mus.",Applying
10,745,590,2021-12-22 11:01:00,DiamNam.mpeg,"Proin eu mi. Nulla ac enim. In tempor, turpis nec euismod scelerisque, quam turpis adipiscing lorem, vitae mattis nibh ligula nec sem.","Morbi non lectus. Aliquam sit amet diam in magna bibendum imperdiet. Nullam orci pede, venenatis non, sodales sed, tincidunt eu, felis.",,Applying
12,473,843,2021-12-26 10:21:00,VestibulumAnte.tiff,Etiam vel augue. Vestibulum rutrum rutrum neque. Aenean auctor gravida sem.,"Proin interdum mauris non ligula pellentesque ultrices. Phasellus id sapien in sapien iaculis congue. Vivamus metus arcu, adipiscing molestie, hendrerit at, vulputate vitae, nisl.",,Applying
21,157,344,2021-08-05 01:51:00,MaecenasLeo.avi,"Lorem ipsum dolor sit amet, consectetuer adipiscing elit. Proin risus. Praesent lectus.",Cras non velit nec nisi vulputate nonummy. Maecenas tincidunt lacus at velit. Vivamus vel nulla eget eros elementum pellentesque.,"Curabitur in libero ut massa volutpat convallis. Morbi odio odio, elementum eu, interdum eu, tincidunt in, leo. Maecenas pulvinar lobortis est.",Applying
22,526,755,2021-10-21 15:24:00,MaecenasTinciduntLacus.doc,Cras non velit nec nisi vulputate nonummy. Maecenas tincidunt lacus at velit. Vivamus vel nulla eget eros elementum pellentesque.,"Morbi porttitor lorem id ligula. Suspendisse ornare consequat lectus. In est risus, auctor sed, tristique in, tempus sit amet, sem.",,Applying
30,611,849,2021-03-26 07:59:00,Sit.ppt,"Lorem ipsum dolor sit amet, consectetuer adipiscing elit. Proin risus. Praesent lectus.","Vestibulum quam sapien, varius ut, blandit non, interdum in, ante. Vestibulum ante ipsum primis in faucibus orci luctus et ultrices posuere cubilia Curae; Duis faucibus accumsan odio. Curabitur convallis.",,Applying
37,42,606,2021-03-31 03:29:00,NibhLigulaNec.avi,"Fusce posuere felis sed lacus. Morbi sem mauris, laoreet ut, rhoncus aliquet, pulvinar sed, nisl. Nunc rhoncus dui vel sem.",Phasellus sit amet erat. Nulla tempus. Vivamus in felis eu sapien cursus vestibulum.,Suspendisse potenti. In eleifend quam a odio. In hac habitasse platea dictumst.,Applying
41,107,635,2021-05-21 03:19:00,DuiMaecenas.ppt,Maecenas ut massa quis augue luctus tincidunt. Nulla mollis molestie lorem. Quisque ut erat.,Maecenas ut massa quis augue luctus tincidunt. Nulla mollis molestie lorem. Quisque ut erat.,"Aenean fermentum. Donec ut mauris eget massa tempor convallis. Nulla neque libero, convallis eget, eleifend luctus, ultricies eu, nibh.",Applying
46,127,438,2021-02-22 06:19:00,SemMaurisLaoreet.jpeg,"Morbi non lectus. Aliquam sit amet diam in magna bibendum imperdiet. Nullam orci pede, venenatis non, sodales sed, tincidunt eu, felis.",In hac habitasse platea dictumst. Etiam faucibus cursus urna. Ut tellus.,"Proin leo odio, porttitor id, consequat in, consequat ut, nulla. Sed accumsan felis. Ut at dolor quis odio consequat varius.",Applying
52,237,529,2021-06-24 07:34:00,Ante.avi,"Lorem ipsum dolor sit amet, consectetuer adipiscing elit. Proin risus. Praesent lectus.","Curabitur at ipsum ac tellus semper interdum. Mauris ullamcorper purus sit amet nulla. Quisque arcu libero, rutrum ac, lobortis vel, dapibus at, diam.",Duis consequat dui nec nisi volutpat eleifend. Donec ut dolor. Morbi vel lectus in quam fringilla rhoncus.,Applying
60,903,839,2021-09-04 19:09:00,Nam.mp3,"In sagittis dui vel nisl. Duis ac nibh. Fusce lacus purus, aliquet at, feugiat non, pretium quis, lectus.","Curabitur at ipsum ac tellus semper interdum. Mauris ullamcorper purus sit amet nulla. Quisque arcu libero, rutrum ac, lobortis vel, dapibus at, diam.",,Applying
64,685,391,2021-01-02 01:20:00,SitAmetEros.tiff,"Vestibulum ac est lacinia nisi venenatis tristique. Fusce congue, diam id ornare imperdiet, sapien urna pretium nisl, ut volutpat sapien arcu sed augue. Aliquam erat volutpat.","Lorem ipsum dolor sit amet, consectetuer adipiscing elit. Proin risus. Praesent lectus.","Morbi non lectus. Aliquam sit amet diam in magna bibendum imperdiet. Nullam orci pede, venenatis non, sodales sed, tincidunt eu, felis.",Applying
68,441,937,2021-02-25 18:40:00,DuiMaecenas.tiff,"Duis bibendum, felis sed interdum venenatis, turpis enim blandit mi, in porttitor pede justo eu massa. Donec dapibus. Duis at velit eu est congue elementum.","Curabitur gravida nisi at nibh. In hac habitasse platea dictumst. Aliquam augue quam, sollicitudin vitae, consectetuer eget, rutrum at, lorem.",,Applying
69,432,978,2021-02-11 04:02:00,DapibusNulla.mp3,"Cum sociis natoque penatibus et magnis dis parturient montes, nascetur ridiculus mus. Vivamus vestibulum sagittis sapien. Cum sociis natoque penatibus et magnis dis parturient montes, nascetur ridiculus mus.",Phasellus sit amet erat. Nulla tempus. Vivamus in felis eu sapien cursus vestibulum.,"Proin eu mi. Nulla ac enim. In tempor, turpis nec euismod scelerisque, quam turpis adipiscing lorem, vitae mattis nibh ligula nec sem.",Applying
82,403,937,2021-10-26 00:53:00,EtUltrices.mp3,"Donec diam neque, vestibulum eget, vulputate ut, ultrices vel, augue. Vestibulum ante ipsum primis in faucibus orci luctus et ultrices posuere cubilia Curae; Donec pharetra, magna vestibulum aliquet ultrices, erat tortor sollicitudin mi, sit amet lobortis sapien sapien non mi. Integer ac neque.","In hac habitasse platea dictumst. Morbi vestibulum, velit id pretium iaculis, diam erat fermentum justo, nec condimentum neque sapien placerat ante. Nulla justo.",In hac habitasse platea dictumst. Etiam faucibus cursus urna. Ut tellus.,Applying
89,845,923,2021-06-06 05:33:00,MiSitAmet.gif,Praesent id massa id nisl venenatis lacinia. Aenean sit amet justo. Morbi ut odio.,"Proin leo odio, porttitor id, consequat in, consequat ut, nulla. Sed accumsan felis. Ut at dolor quis odio consequat varius.",Fusce consequat. Nulla nisl. Nunc nisl.,Applying
94,37,187,2021-02-16 18:11:00,Id.tiff,"Proin interdum mauris non ligula pellentesque ultrices. Phasellus id sapien in sapien iaculis congue. Vivamus metus arcu, adipiscing molestie, hendrerit at, vulputate vitae, nisl.","Cum sociis natoque penatibus et magnis dis parturient montes, nascetur ridiculus mus. Vivamus vestibulum sagittis sapien. Cum sociis natoque penatibus et magnis dis parturient montes, nascetur ridiculus mus.","Maecenas tristique, est et tempus semper, est quam pharetra magna, ac consequat metus sapien ut nunc. Vestibulum ante ipsum primis in faucibus orci luctus et ultrices posuere cubilia Curae; Mauris viverra diam vitae quam. Suspendisse potenti.",Applying
95,728,110,2021-06-26 09:57:00,VenenatisNon.mp3,"Duis bibendum, felis sed interdum venenatis, turpis enim blandit mi, in porttitor pede justo eu massa. Donec dapibus. Duis at velit eu est congue elementum.","In sagittis dui vel nisl. Duis ac nibh. Fusce lacus purus, aliquet at, feugiat non, pretium quis, lectus.",,Applying
98,421,465,2021-09-11 02:28:00,MetusSapienUt.mp3,"Mauris enim leo, rhoncus sed, vestibulum sit amet, cursus id, turpis. Integer aliquet, massa id lobortis convallis, tortor risus dapibus augue, vel accumsan tellus nisi eu orci. Mauris lacinia sapien quis libero.",Nullam porttitor lacus at turpis. Donec posuere metus vitae ipsum. Aliquam non mauris.,In quis justo. Maecenas rhoncus aliquam lacus. Morbi quis tortor id nulla ultrices aliquet.,Applying
99,826,419,2021-06-03 03:48:00,LuctusCum.mp3,Fusce consequat. Nulla nisl. Nunc nisl.,Integer tincidunt ante vel ipsum. Praesent blandit lacinia erat. Vestibulum sed magna at nunc commodo placerat.,Duis aliquam convallis nunc. Proin at turpis a pede posuere nonummy. Integer non velit.,Applying
101,461,451,2021-07-31 14:41:00,Nunc.png,Suspendisse potenti. In eleifend quam a odio. In hac habitasse platea dictumst.,Aenean lectus. Pellentesque eget nunc. Donec quis orci eget orci vehicula condimentum.,,Applying
104,503,172,2021-10-29 22:51:00,SagittisNamCongue.ppt,"Morbi non lectus. Aliquam sit amet diam in magna bibendum imperdiet. Nullam orci pede, venenatis non, sodales sed, tincidunt eu, felis.","Duis bibendum, felis sed interdum venenatis, turpis enim blandit mi, in porttitor pede justo eu massa. Donec dapibus. Duis at velit eu est congue elementum.","Morbi non lectus. Aliquam sit amet diam in magna bibendum imperdiet. Nullam orci pede, venenatis non, sodales sed, tincidunt eu, felis.",Applying
107,580,145,2021-09-18 11:04:00,CurabiturInLibero.mpeg,"Donec diam neque, vestibulum eget, vulputate ut, ultrices vel, augue. Vestibulum ante ipsum primis in faucibus orci luctus et ultrices posuere cubilia Curae; Donec pharetra, magna vestibulum aliquet ultrices, erat tortor sollicitudin mi, sit amet lobortis sapien sapien non mi. Integer ac neque.","Curabitur at ipsum ac tellus semper interdum. Mauris ullamcorper purus sit amet nulla. Quisque arcu libero, rutrum ac, lobortis vel, dapibus at, diam.",Duis aliquam convallis nunc. Proin at turpis a pede posuere nonummy. Integer non velit.,Applying
114,450,43,2021-02-07 15:47:00,BibendumFelis.mp3,Nullam sit amet turpis elementum ligula vehicula consequat. Morbi a ipsum. Integer a nibh.,"Donec diam neque, vestibulum eget, vulputate ut, ultrices vel, augue. Vestibulum ante ipsum primis in faucibus orci luctus et ultrices posuere cubilia Curae; Donec pharetra, magna vestibulum aliquet ultrices, erat tortor sollicitudin mi, sit amet lobortis sapien sapien non mi. Integer ac neque.",,Applying
117,605,679,2021-12-28 21:26:00,VestibulumVestibulum.mp3,"In hac habitasse platea dictumst. Morbi vestibulum, velit id pretium iaculis, diam erat fermentum justo, nec condimentum neque sapien placerat ante. Nulla justo.","Morbi porttitor lorem id ligula. Suspendisse ornare consequat lectus. In est risus, auctor sed, tristique in, tempus sit amet, sem.","Mauris enim leo, rhoncus sed, vestibulum sit amet, cursus id, turpis. Integer aliquet, massa id lobortis convallis, tortor risus dapibus augue, vel accumsan tellus nisi eu orci. Mauris lacinia sapien quis libero.",Applying
119,731,932,2021-12-13 23:05:00,Dolor.avi,In congue. Etiam justo. Etiam pretium iaculis justo.,In congue. Etiam justo. Etiam pretium iaculis justo.,"Maecenas tristique, est et tempus semper, est quam pharetra magna, ac consequat metus sapien ut nunc. Vestibulum ante ipsum primis in faucibus orci luctus et ultrices posuere cubilia Curae; Mauris viverra diam vitae quam. Suspendisse potenti.",Applying
123,715,102,2021-07-08 08:42:00,DonecOdioJusto.ppt,Nullam porttitor lacus at turpis. Donec posuere metus vitae ipsum. Aliquam non mauris.,Sed ante. Vivamus tortor. Duis mattis egestas metus.,Integer ac leo. Pellentesque ultrices mattis odio. Donec vitae nisi.,Applying
125,148,296,2021-06-15 22:39:00,TempusVivamusIn.jpeg,Cras non velit nec nisi vulputate nonummy. Maecenas tincidunt lacus at velit. Vivamus vel nulla eget eros elementum pellentesque.,"Vestibulum quam sapien, varius ut, blandit non, interdum in, ante. Vestibulum ante ipsum primis in faucibus orci luctus et ultrices posuere cubilia Curae; Duis faucibus accumsan odio. Curabitur convallis.","Fusce posuere felis sed lacus. Morbi sem mauris, laoreet ut, rhoncus aliquet, pulvinar sed, nisl. Nunc rhoncus dui vel sem.",Applying
134,505,621,2021-09-06 15:33:00,Morbi.xls,"Proin eu mi. Nulla ac enim. In tempor, turpis nec euismod scelerisque, quam turpis adipiscing lorem, vitae mattis nibh ligula nec sem.","Quisque id justo sit amet sapien dignissim vestibulum. Vestibulum ante ipsum primis in faucibus orci luctus et ultrices posuere cubilia Curae; Nulla dapibus dolor vel est. Donec odio justo, sollicitudin ut, suscipit a, feugiat et, eros.","Maecenas tristique, est et tempus semper, est quam pharetra magna, ac consequat metus sapien ut nunc. Vestibulum ante ipsum primis in faucibus orci luctus et ultrices posuere cubilia Curae; Mauris viverra diam vitae quam. Suspendisse potenti.",Applying
150,421,858,2021-01-21 15:36:00,NonMiInteger.mp3,"Vestibulum quam sapien, varius ut, blandit non, interdum in, ante. Vestibulum ante ipsum primis in faucibus orci luctus et ultrices posuere cubilia Curae; Duis faucibus accumsan odio. Curabitur convallis.",Nullam sit amet turpis elementum ligula vehicula consequat. Morbi a ipsum. Integer a nibh.,Pellentesque at nulla. Suspendisse potenti. Cras in purus eu magna vulputate luctus.,Applying
155,313,109,2021-01-20 11:15:00,Fringilla.avi,"Curabitur gravida nisi at nibh. In hac habitasse platea dictumst. Aliquam augue quam, sollicitudin vitae, consectetuer eget, rutrum at, lorem.",Aenean lectus. Pellentesque eget nunc. Donec quis orci eget orci vehicula condimentum.,,Applying
156,912,808,2021-11-21 06:02:00,TurpisNecEuismod.mp3,"Duis bibendum, felis sed interdum venenatis, turpis enim blandit mi, in porttitor pede justo eu massa. Donec dapibus. Duis at velit eu est congue elementum.",Integer ac leo. Pellentesque ultrices mattis odio. Donec vitae nisi.,Nullam porttitor lacus at turpis. Donec posuere metus vitae ipsum. Aliquam non mauris.,Applying
157,406,580,2021-10-24 12:12:00,Suspendisse.mov,Duis bibendum. Morbi non quam nec dui luctus rutrum. Nulla tellus.,In quis justo. Maecenas rhoncus aliquam lacus. Morbi quis tortor id nulla ultrices aliquet.,"Lorem ipsum dolor sit amet, consectetuer adipiscing elit. Proin risus. Praesent lectus.",Applying
161,885,635,2021-07-24 07:26:00,EnimSit.avi,"In hac habitasse platea dictumst. Morbi vestibulum, velit id pretium iaculis, diam erat fermentum justo, nec condimentum neque sapien placerat ante. Nulla justo.","Donec diam neque, vestibulum eget, vulputate ut, ultrices vel, augue. Vestibulum ante ipsum primis in faucibus orci luctus et ultrices posuere cubilia Curae; Donec pharetra, magna vestibulum aliquet ultrices, erat tortor sollicitudin mi, sit amet lobortis sapien sapien non mi. Integer ac neque.","Quisque id justo sit amet sapien dignissim vestibulum. Vestibulum ante ipsum primis in faucibus orci luctus et ultrices posuere cubilia Curae; Nulla dapibus dolor vel est. Donec odio justo, sollicitudin ut, suscipit a, feugiat et, eros.",Applying
163,279,589,2021-09-09 06:56:00,Montes.avi,Duis bibendum. Morbi non quam nec dui luctus rutrum. Nulla tellus.,"Morbi non lectus. Aliquam sit amet diam in magna bibendum imperdiet. Nullam orci pede, venenatis non, sodales sed, tincidunt eu, felis.","Morbi porttitor lorem id ligula. Suspendisse ornare consequat lectus. In est risus, auctor sed, tristique in, tempus sit amet, sem.",Applying
165,260,260,2021-03-11 15:18:00,SodalesSedTincidunt.png,Phasellus in felis. Donec semper sapien a libero. Nam dui.,"Aenean fermentum. Donec ut mauris eget massa tempor convallis. Nulla neque libero, convallis eget, eleifend luctus, ultricies eu, nibh.",Nullam porttitor lacus at turpis. Donec posuere metus vitae ipsum. Aliquam non mauris.,Applying
170,588,867,2021-06-19 16:31:00,EtiamJusto.png,"Lorem ipsum dolor sit amet, consectetuer adipiscing elit. Proin risus. Praesent lectus.","Maecenas leo odio, condimentum id, luctus nec, molestie sed, justo. Pellentesque viverra pede ac diam. Cras pellentesque volutpat dui.","Aenean fermentum. Donec ut mauris eget massa tempor convallis. Nulla neque libero, convallis eget, eleifend luctus, ultricies eu, nibh.",Applying
179,425,199,2021-10-10 20:05:00,EgetTempus.doc,"Duis bibendum, felis sed interdum venenatis, turpis enim blandit mi, in porttitor pede justo eu massa. Donec dapibus. Duis at velit eu est congue elementum.","Quisque id justo sit amet sapien dignissim vestibulum. Vestibulum ante ipsum primis in faucibus orci luctus et ultrices posuere cubilia Curae; Nulla dapibus dolor vel est. Donec odio justo, sollicitudin ut, suscipit a, feugiat et, eros.","Donec diam neque, vestibulum eget, vulputate ut, ultrices vel, augue. Vestibulum ante ipsum primis in faucibus orci luctus et ultrices posuere cubilia Curae; Donec pharetra, magna vestibulum aliquet ultrices, erat tortor sollicitudin mi, sit amet lobortis sapien sapien non mi. Integer ac neque.",Applying
180,589,461,2021-05-06 12:37:00,ConvallisMorbiOdio.pdf,Nulla ut erat id mauris vulputate elementum. Nullam varius. Nulla facilisi.,"Proin eu mi. Nulla ac enim. In tempor, turpis nec euismod scelerisque, quam turpis adipiscing lorem, vitae mattis nibh ligula nec sem.",In congue. Etiam justo. Etiam pretium iaculis justo.,Applying
181,967,525,2021-09-12 01:02:00,MaurisEnimLeo.gif,Sed ante. Vivamus tortor. Duis mattis egestas metus.,In quis justo. Maecenas rhoncus aliquam lacus. Morbi quis tortor id nulla ultrices aliquet.,,Applying
186,981,451,2021-02-15 02:31:00,AugueVelAccumsan.mp3,"Maecenas tristique, est et tempus semper, est quam pharetra magna, ac consequat metus sapien ut nunc. Vestibulum ante ipsum primis in faucibus orci luctus et ultrices posuere cubilia Curae; Mauris viverra diam vitae quam. Suspendisse potenti.",Cras non velit nec nisi vulputate nonummy. Maecenas tincidunt lacus at velit. Vivamus vel nulla eget eros elementum pellentesque.,"Vestibulum ac est lacinia nisi venenatis tristique. Fusce congue, diam id ornare imperdiet, sapien urna pretium nisl, ut volutpat sapien arcu sed augue. Aliquam erat volutpat.",Applying
191,903,369,2021-02-11 23:04:00,Mauris.tiff,In congue. Etiam justo. Etiam pretium iaculis justo.,"In hac habitasse platea dictumst. Morbi vestibulum, velit id pretium iaculis, diam erat fermentum justo, nec condimentum neque sapien placerat ante. Nulla justo.","Curabitur in libero ut massa volutpat convallis. Morbi odio odio, elementum eu, interdum eu, tincidunt in, leo. Maecenas pulvinar lobortis est.",Applying
197,836,510,2021-11-21 07:47:00,SapienPlacerat.txt,"Sed sagittis. Nam congue, risus semper porta volutpat, quam pede lobortis ligula, sit amet eleifend pede libero quis orci. Nullam molestie nibh in lectus.",Nullam sit amet turpis elementum ligula vehicula consequat. Morbi a ipsum. Integer a nibh.,Phasellus in felis. Donec semper sapien a libero. Nam dui.,Applying
199,691,70,2021-10-21 16:10:00,Orci.ppt,In hac habitasse platea dictumst. Etiam faucibus cursus urna. Ut tellus.,"In hac habitasse platea dictumst. Morbi vestibulum, velit id pretium iaculis, diam erat fermentum justo, nec condimentum neque sapien placerat ante. Nulla justo.",,Applying
202,299,176,2021-11-09 21:10:00,NonInterdum.mp3,"Aenean fermentum. Donec ut mauris eget massa tempor convallis. Nulla neque libero, convallis eget, eleifend luctus, ultricies eu, nibh.","Vestibulum quam sapien, varius ut, blandit non, interdum in, ante. Vestibulum ante ipsum primis in faucibus orci luctus et ultrices posuere cubilia Curae; Duis faucibus accumsan odio. Curabitur convallis.",Nulla ut erat id mauris vulputate elementum. Nullam varius. Nulla facilisi.,Applying
208,331,29,2021-02-24 11:24:00,FelisUtAt.gif,Aenean lectus. Pellentesque eget nunc. Donec quis orci eget orci vehicula condimentum.,Duis aliquam convallis nunc. Proin at turpis a pede posuere nonummy. Integer non velit.,,Applying
209,59,980,2021-10-26 05:59:00,Morbi.ppt,"Lorem ipsum dolor sit amet, consectetuer adipiscing elit. Proin risus. Praesent lectus.",Nulla ut erat id mauris vulputate elementum. Nullam varius. Nulla facilisi.,"Maecenas leo odio, condimentum id, luctus nec, molestie sed, justo. Pellentesque viverra pede ac diam. Cras pellentesque volutpat dui.",Applying
219,22,394,2021-04-18 11:53:00,IdNullaUltrices.doc,"Vestibulum ac est lacinia nisi venenatis tristique. Fusce congue, diam id ornare imperdiet, sapien urna pretium nisl, ut volutpat sapien arcu sed augue. Aliquam erat volutpat.","Duis bibendum, felis sed interdum venenatis, turpis enim blandit mi, in porttitor pede justo eu massa. Donec dapibus. Duis at velit eu est congue elementum.","Maecenas leo odio, condimentum id, luctus nec, molestie sed, justo. Pellentesque viverra pede ac diam. Cras pellentesque volutpat dui.",Applying
224,643,31,2021-11-21 12:42:00,Mi.ppt,Integer tincidunt ante vel ipsum. Praesent blandit lacinia erat. Vestibulum sed magna at nunc commodo placerat.,"Aenean fermentum. Donec ut mauris eget massa tempor convallis. Nulla neque libero, convallis eget, eleifend luctus, ultricies eu, nibh.","Proin leo odio, porttitor id, consequat in, consequat ut, nulla. Sed accumsan felis. Ut at dolor quis odio consequat varius.",Applying
241,695,525,2021-05-19 07:32:00,Neque.txt,"Mauris enim leo, rhoncus sed, vestibulum sit amet, cursus id, turpis. Integer aliquet, massa id lobortis convallis, tortor risus dapibus augue, vel accumsan tellus nisi eu orci. Mauris lacinia sapien quis libero.",In hac habitasse platea dictumst. Etiam faucibus cursus urna. Ut tellus.,"Vestibulum ac est lacinia nisi venenatis tristique. Fusce congue, diam id ornare imperdiet, sapien urna pretium nisl, ut volutpat sapien arcu sed augue. Aliquam erat volutpat.",Applying
243,739,492,2021-06-18 22:50:00,NullamVariusNulla.mp3,Etiam vel augue. Vestibulum rutrum rutrum neque. Aenean auctor gravida sem.,"Quisque porta volutpat erat. Quisque erat eros, viverra eget, congue eget, semper rutrum, nulla. Nunc purus.",,Applying
263,343,491,2021-02-05 09:46:00,Blandit.mp3,Duis bibendum. Morbi non quam nec dui luctus rutrum. Nulla tellus.,Aenean lectus. Pellentesque eget nunc. Donec quis orci eget orci vehicula condimentum.,Etiam vel augue. Vestibulum rutrum rutrum neque. Aenean auctor gravida sem.,Applying
273,901,182,2021-10-29 04:32:00,InFelisEu.jpeg,Aenean lectus. Pellentesque eget nunc. Donec quis orci eget orci vehicula condimentum.,Cras non velit nec nisi vulputate nonummy. Maecenas tincidunt lacus at velit. Vivamus vel nulla eget eros elementum pellentesque.,,Applying
280,579,98,2021-11-16 15:40:00,MusEtiamVel.avi,Phasellus sit amet erat. Nulla tempus. Vivamus in felis eu sapien cursus vestibulum.,"Sed sagittis. Nam congue, risus semper porta volutpat, quam pede lobortis ligula, sit amet eleifend pede libero quis orci. Nullam molestie nibh in lectus.",,Applying
286,577,639,2021-04-29 01:47:00,DuiLuctusRutrum.mpeg,"Quisque id justo sit amet sapien dignissim vestibulum. Vestibulum ante ipsum primis in faucibus orci luctus et ultrices posuere cubilia Curae; Nulla dapibus dolor vel est. Donec odio justo, sollicitudin ut, suscipit a, feugiat et, eros.","Vestibulum quam sapien, varius ut, blandit non, interdum in, ante. Vestibulum ante ipsum primis in faucibus orci luctus et ultrices posuere cubilia Curae; Duis faucibus accumsan odio. Curabitur convallis.",Nulla ut erat id mauris vulputate elementum. Nullam varius. Nulla facilisi.,Applying
290,738,323,2021-12-09 02:47:00,Ac.avi,"In sagittis dui vel nisl. Duis ac nibh. Fusce lacus purus, aliquet at, feugiat non, pretium quis, lectus.",Nullam porttitor lacus at turpis. Donec posuere metus vitae ipsum. Aliquam non mauris.,Aliquam quis turpis eget elit sodales scelerisque. Mauris sit amet eros. Suspendisse accumsan tortor quis turpis.,Applying
299,580,204,2021-05-24 09:51:00,LuctusCumSociis.pdf,"Aenean fermentum. Donec ut mauris eget massa tempor convallis. Nulla neque libero, convallis eget, eleifend luctus, ultricies eu, nibh.","In hac habitasse platea dictumst. Morbi vestibulum, velit id pretium iaculis, diam erat fermentum justo, nec condimentum neque sapien placerat ante. Nulla justo.","Curabitur at ipsum ac tellus semper interdum. Mauris ullamcorper purus sit amet nulla. Quisque arcu libero, rutrum ac, lobortis vel, dapibus at, diam.",Applying
307,169,504,2021-09-09 02:33:00,AliquamNonMauris.jpeg,Duis aliquam convallis nunc. Proin at turpis a pede posuere nonummy. Integer non velit.,"Quisque porta volutpat erat. Quisque erat eros, viverra eget, congue eget, semper rutrum, nulla. Nunc purus.",,Applying
308,872,443,2021-11-03 10:44:00,Fringilla.xls,"Maecenas tristique, est et tempus semper, est quam pharetra magna, ac consequat metus sapien ut nunc. Vestibulum ante ipsum primis in faucibus orci luctus et ultrices posuere cubilia Curae; Mauris viverra diam vitae quam. Suspendisse potenti.","In hac habitasse platea dictumst. Morbi vestibulum, velit id pretium iaculis, diam erat fermentum justo, nec condimentum neque sapien placerat ante. Nulla justo.",,Applying
329,7,600,2021-12-05 06:53:00,PharetraMagna.mp3,Integer ac leo. Pellentesque ultrices mattis odio. Donec vitae nisi.,"Quisque id justo sit amet sapien dignissim vestibulum. Vestibulum ante ipsum primis in faucibus orci luctus et ultrices posuere cubilia Curae; Nulla dapibus dolor vel est. Donec odio justo, sollicitudin ut, suscipit a, feugiat et, eros.",Maecenas ut massa quis augue luctus tincidunt. Nulla mollis molestie lorem. Quisque ut erat.,Applying
348,808,378,2021-11-03 09:18:00,Penatibus.tiff,Praesent id massa id nisl venenatis lacinia. Aenean sit amet justo. Morbi ut odio.,"Morbi porttitor lorem id ligula. Suspendisse ornare consequat lectus. In est risus, auctor sed, tristique in, tempus sit amet, sem.",,Applying
